<?xml version="1.0" encoding="UTF-8"?>
<matrixDB xmlns:xsi="http://www.w3.org/2001/XMLSchema-instance" xsi:noNamespaceSchemaLocation="matrix.xsd">
    <matrix type="RSVG">
        <A></A>
        <B></B>
        <C></C>
        <D></D>
        <E></E>
        <F></F>
        <G></G>
        <H></H>
        <I></I>
        <J></J>
        <K></K>
        <L></L>
        <M></M>
        <N></N>
        <O></O>
        <P></P>
        <Q></Q>
        <R>r_rsvg.txt</R>
        <S></S>
        <T></T>
        <U></U>
        <V></V>
        <W></W>
        <X></X>
        <Y></Y>
        <Z></Z>
        <a></a>
        <b></b>
        <c></c>
        <d></d>
        <e></e>
        <f></f>
        <g></g>
        <h></h>
        <i></i>
        <j></j>
        <k></k>
        <l></l>
        <m></m>
        <n></n>
        <o></o>
        <p></p>
        <q></q>
        <r></r>
        <s></s>
        <t></t>
        <u></u>
        <v></v>
        <w></w>
        <x></x>
        <y></y>
        <z></z>
        <Ä></Ä>
        <ä></ä>
        <Ö></Ö>
        <ö></ö>
        <Ü></Ü>
        <ü></ü>
        <ß></ß>
        <n0></n0>
        <n1></n1>
        <n2></n2>
        <n3></n3>
        <n4></n4>
        <n5></n5>
        <n6></n6>
        <n7></n7>
        <n8></n8>
        <n9></n9>
        <n0></n0>
        <nD></nD>
        <nE></nE>
    </matrix>
</matrixDB>